URL_citacion,Title,Citation_URL,Authors,Year,Number_of_Citations
"https://scholar.google.com/scholar?cites=7776129706206899416&as_sdt=20000005&sciodt=0,21&hl=en&oe=ASCII&start=10",Do opportunistic snap elections affect political trust? Evidence from a natural experiment,https://ejpr.onlinelibrary.wiley.com/doi/abs/10.1111/1475-6765.12531,SJ TURNBULL‐DUGARTE,,13
"https://scholar.google.com/scholar?cites=7776129706206899416&as_sdt=20000005&sciodt=0,21&hl=en&oe=ASCII&start=10",Early marriages last longer: Pre-electoral coalitions and government survival in Europe,https://www.cambridge.org/core/journals/government-and-opposition/article/early-marriages-last-longer-preelectoral-coalitions-and-government-survival-in-europe/024CCAA3ED6F29D1B4582BF25E07F4FC,M Chiru,,64
"https://scholar.google.com/scholar?cites=7776129706206899416&as_sdt=20000005&sciodt=0,21&hl=en&oe=ASCII&start=10",Stability of minority governments and the role of support agreements,https://www.tandfonline.com/doi/abs/10.1080/01402382.2021.1890455,"S Krauss, M Thürk",,25
"https://scholar.google.com/scholar?cites=7776129706206899416&as_sdt=20000005&sciodt=0,21&hl=en&oe=ASCII&start=10",How women in the executive influence government stability,https://www.tandfonline.com/doi/abs/10.1080/13501763.2020.1773905,"S Krauss, C Kroeber",,24
"https://scholar.google.com/scholar?cites=7776129706206899416&as_sdt=20000005&sciodt=0,21&hl=en&oe=ASCII&start=10",Dodging the bullet: How crises trigger technocrat‐led governments,https://ejpr.onlinelibrary.wiley.com/doi/abs/10.1111/1475-6765.12234,"C Wratil, G Pastorella",,45
"https://scholar.google.com/scholar?cites=7776129706206899416&as_sdt=20000005&sciodt=0,21&hl=en&oe=ASCII&start=10","The political consequences of terrorism: Terror events, casualties, and government duration",https://academic.oup.com/isp/article-abstract/14/3/343/1800991,"LK Williams, MT Koch, JM Smith",,61
"https://scholar.google.com/scholar?cites=7776129706206899416&as_sdt=20000005&sciodt=0,21&hl=en&oe=ASCII&start=10",,,,,0
"https://scholar.google.com/scholar?cites=7776129706206899416&as_sdt=20000005&sciodt=0,21&hl=en&oe=ASCII&start=20","Constitutional power and competing risks: Monarchs, presidents, prime ministers, and the...","https://scholar.google.com/scholar?cluster=7776129706206899416&hl=en&as_sdt=20000005&sciodt=0,21",,,0
"https://scholar.google.com/scholar?cites=7776129706206899416&as_sdt=20000005&sciodt=0,21&hl=en&oe=ASCII&start=20",Assembly dissolution powers and incumbency advantages in coalition formation,https://www.tandfonline.com/doi/abs/10.1080/01402382.2023.2165356,"P Schleiter, C Bucur",,5
"https://scholar.google.com/scholar?cites=7776129706206899416&as_sdt=20000005&sciodt=0,21&hl=en&oe=ASCII&start=20",Government termination in Europe: a sensitivity analysis,https://www.tandfonline.com/doi/abs/10.1080/01402382.2021.1880720,"D Walther, J Hellström",,15
"https://scholar.google.com/scholar?cites=7776129706206899416&as_sdt=20000005&sciodt=0,21&hl=en&oe=ASCII&start=20",Who “wins”? Determining the party of the prime minister,https://onlinelibrary.wiley.com/doi/abs/10.1111/j.1540-5907.2011.00524.x,"G Glasgow, M Golder, SN Golder",,65
"https://scholar.google.com/scholar?cites=7776129706206899416&as_sdt=20000005&sciodt=0,21&hl=en&oe=ASCII&start=20",Coalition dynamics: advances in the study of the coalition life cycle,https://www.tandfonline.com/doi/abs/10.1080/01402382.2023.2249316,"WC Müller, H Bäck, J Hellström",,5
"https://scholar.google.com/scholar?cites=7776129706206899416&as_sdt=20000005&sciodt=0,21&hl=en&oe=ASCII&start=20",Coalition mood in European parliamentary democracies,https://www.cambridge.org/core/journals/british-journal-of-political-science/article/coalition-mood-in-european-parliamentary-democracies/5DA0CDBF562E6655541E4762CA590501,"M Imre, A Ecker, TM Meyer, WC Müller",,9
"https://scholar.google.com/scholar?cites=7776129706206899416&as_sdt=20000005&sciodt=0,21&hl=en&oe=ASCII&start=20",Early election calling and satisfaction with democracy,https://www.cambridge.org/core/journals/government-and-opposition/article/early-election-calling-and-satisfaction-with-democracy/D13FEAF0CC647D158433C5027BC978D4,E Morgan,,13
"https://scholar.google.com/scholar?cites=7776129706206899416&as_sdt=20000005&sciodt=0,21&hl=en&oe=ASCII&start=20",Government survival in semi‐presidential regimes,https://ejpr.onlinelibrary.wiley.com/doi/abs/10.1111/1475-6765.12116,"JM Fernandes, PC Magalhães",,39
"https://scholar.google.com/scholar?cites=7776129706206899416&as_sdt=20000005&sciodt=0,21&hl=en&oe=ASCII&start=20",The primacy of experts? Non-partisan ministers in Portuguese democracy,https://link.springer.com/chapter/10.1007/978-3-319-62313-9_5,"A Costa Pinto, P Tavares de Almeida",,28
"https://scholar.google.com/scholar?cites=7776129706206899416&as_sdt=20000005&sciodt=0,21&hl=en&oe=ASCII&start=20",Working through the issues: how issue diversity and ideological disagreement influence coalition duration,https://www.cambridge.org/core/journals/european-political-science-review/article/working-through-the-issues-how-issue-diversity-and-ideological-disagreement-influence-coalition-duration/70B0F5FF6AB9521A6F5F7A3382D1ACCB,Z Greene,,29
"https://scholar.google.com/scholar?cites=7776129706206899416&as_sdt=20000005&sciodt=0,21&hl=en&oe=ASCII&start=20",Flexible election timing and international conflict,https://academic.oup.com/isq/article-abstract/57/3/449/1802940,LK Williams,,43
"https://scholar.google.com/scholar?cites=7776129706206899416&as_sdt=20000005&sciodt=0,21&hl=en&oe=ASCII&start=20",,,,,0
"https://scholar.google.com/scholar?cites=7776129706206899416&as_sdt=20000005&sciodt=0,21&hl=en&oe=ASCII&start=30","Constitutional power and competing risks: Monarchs, presidents, prime ministers, and the...","https://scholar.google.com/scholar?cluster=7776129706206899416&hl=en&as_sdt=20000005&sciodt=0,21",,,0
"https://scholar.google.com/scholar?cites=7776129706206899416&as_sdt=20000005&sciodt=0,21&hl=en&oe=ASCII&start=30",Organized interests in constitutional assemblies: Egypt and Tunisia in comparison,https://journals.sagepub.com/doi/abs/10.1177/1065912917695190,IM Hartshorn,,26
"https://scholar.google.com/scholar?cites=7776129706206899416&as_sdt=20000005&sciodt=0,21&hl=en&oe=ASCII&start=30",Caretaker governments in Czech politics: What to do about a government crisis,https://www.tandfonline.com/doi/abs/10.1080/09668136.2014.941700,"V Hloušek, L Kopeček",,36
"https://scholar.google.com/scholar?cites=7776129706206899416&as_sdt=20000005&sciodt=0,21&hl=en&oe=ASCII&start=30",A new approach to the study of parties entering government,https://www.cambridge.org/core/journals/british-journal-of-political-science/article/new-approach-to-the-study-of-parties-entering-government/A80B2DD8FAFF7768E759595E29451F43,"G Glasgow, SN Golder",,33
"https://scholar.google.com/scholar?cites=7776129706206899416&as_sdt=20000005&sciodt=0,21&hl=en&oe=ASCII&start=30","Economic performance, political institutions and cabinet durability in 28 European parliamentary democracies, 1945–2011",https://link.springer.com/chapter/10.1007/978-1-4614-6588-1_4,T Saalfeld,,33
"https://scholar.google.com/scholar?cites=7776129706206899416&as_sdt=20000005&sciodt=0,21&hl=en&oe=ASCII&start=30",Accountability in coalition governments,https://www.annualreviews.org/content/journals/10.1146/annurev.polisci.071108.101919,JM Maravall,,40
"https://scholar.google.com/scholar?cites=7776129706206899416&as_sdt=20000005&sciodt=0,21&hl=en&oe=ASCII&start=30",Beyond party government? Technocratic trends in society and in the executive,https://link.springer.com/chapter/10.1007/978-3-319-62313-9_1,"A Costa Pinto, M Cotta…",,23
"https://scholar.google.com/scholar?cites=7776129706206899416&as_sdt=20000005&sciodt=0,21&hl=en&oe=ASCII&start=30",How parties govern: Political parties and the internal organization of government,https://link.springer.com/chapter/10.1007/978-1-4614-6588-1_3,"T Bergman, A Ecker, WC Müller",,30
"https://scholar.google.com/scholar?cites=7776129706206899416&as_sdt=20000005&sciodt=0,21&hl=en&oe=ASCII&start=30",Presidential Elections and European Party Systems (1848–2020),https://www.cambridge.org/core/journals/british-journal-of-political-science/article/presidential-elections-and-european-party-systems-18482020/EBC92B409CD0EBBD9D759BACE1DDFDDA,"FC Bértoa, T Weber",,0
"https://scholar.google.com/scholar?cites=7776129706206899416&as_sdt=20000005&sciodt=0,21&hl=en&oe=ASCII&start=30","Ministerial survival during political and cabinet change: Foreign affairs, diplomacy and war",https://www.taylorfrancis.com/books/mono/10.4324/9781315639246/ministerial-survival-political-cabinet-change-alejandro-quiroz-flores,AQ Flores,,22
"https://scholar.google.com/scholar?cites=7776129706206899416&as_sdt=20000005&sciodt=0,21&hl=en&oe=ASCII&start=30",Cohabitation and presidential powers: A global examination of dual executives 1850–2022,https://journals.sagepub.com/doi/abs/10.1177/01925121241282789,"C Anckar, T Sedelius",,0
"https://scholar.google.com/scholar?cites=7776129706206899416&as_sdt=20000005&sciodt=0,21&hl=en&oe=ASCII&start=30",,,,,0
"https://scholar.google.com/scholar?cites=7776129706206899416&as_sdt=20000005&sciodt=0,21&hl=en&oe=ASCII&start=40","Constitutional power and competing risks: Monarchs, presidents, prime ministers, and the...","https://scholar.google.com/scholar?cluster=7776129706206899416&hl=en&as_sdt=20000005&sciodt=0,21",,,0
"https://scholar.google.com/scholar?cites=7776129706206899416&as_sdt=20000005&sciodt=0,21&hl=en&oe=ASCII&start=40",How and when do presidents influence the duration of coalition bargaining in semi‐presidential systems?,https://ejpr.onlinelibrary.wiley.com/doi/abs/10.1111/1475-6765.12227,L Savage,,16
"https://scholar.google.com/scholar?cites=7776129706206899416&as_sdt=20000005&sciodt=0,21&hl=en&oe=ASCII&start=40",Government termination in multilevel settings. How party congruence affects the survival of sub-national governments in Germany and Spain,https://www.tandfonline.com/doi/abs/10.1080/17457289.2019.1666272,J Martínez,,13
"https://scholar.google.com/scholar?cites=7776129706206899416&as_sdt=20000005&sciodt=0,21&hl=en&oe=ASCII&start=40","How is government stability affected by the state of the economy? Payoff structures, government type and economic state",https://www.cambridge.org/core/journals/government-and-opposition/article/how-is-government-stability-affected-by-the-state-of-the-economy-payoff-structures-government-type-and-economic-state/FD404D4673E2B39AD61945E1C6CB06BE,"J Hellström, D Walther",,16
"https://scholar.google.com/scholar?cites=7776129706206899416&as_sdt=20000005&sciodt=0,21&hl=en&oe=ASCII&start=40",Terahertz aqueous photonics,https://link.springer.com/article/10.1007/s12200-020-1070-7,"Q Jin, E Yiwen, XC Zhang",,11
"https://scholar.google.com/scholar?cites=7776129706206899416&as_sdt=20000005&sciodt=0,21&hl=en&oe=ASCII&start=40","Symbolic unity, dynastic continuity, and countervailing power: Monarchies, republics, and the economy",https://academic.oup.com/sf/article-abstract/97/2/607/4992685,MF Guillén,,15
"https://scholar.google.com/scholar?cites=7776129706206899416&as_sdt=20000005&sciodt=0,21&hl=en&oe=ASCII&start=40",Presidential Elections and European Party Systems (1848–2020),https://nottingham-repository.worktribe.com/output/30108558,"F Casal Bértoa, T Weber",,2
"https://scholar.google.com/scholar?cites=7776129706206899416&as_sdt=20000005&sciodt=0,21&hl=en&oe=ASCII&start=40","Dying, surviving death, and reincarnating: differences in government replacements and their explanation",https://www.tandfonline.com/doi/abs/10.1080/01402382.2023.2193492,"A Pedrazzani, F Zucchini",,1
"https://scholar.google.com/scholar?cites=7776129706206899416&as_sdt=20000005&sciodt=0,21&hl=en&oe=ASCII&start=40","Opportunistic election timing, a complement or substitute for economic manipulation?",https://www.journals.uchicago.edu/doi/abs/10.1086/707794,"T Beckman, P Schleiter",,12
"https://scholar.google.com/scholar?cites=7776129706206899416&as_sdt=20000005&sciodt=0,21&hl=en&oe=ASCII&start=40",Opposition parties and the timing of successful no-confidence motions,https://www.cambridge.org/core/journals/political-science-research-and-methods/article/opposition-parties-and-the-timing-of-successful-noconfidence-motions/F157E77EA9400D161F488463EFE8B523,LK Williams,,18
"https://scholar.google.com/scholar?cites=7776129706206899416&as_sdt=20000005&sciodt=0,21&hl=en&oe=ASCII&start=40",Presidents shaping public opinion in parliamentary democracies: a survey experiment in Turkey,https://link.springer.com/article/10.1007/s11109-017-9404-x,"SE Aytaç, A Çarkoğlu",,16
"https://scholar.google.com/scholar?cites=7776129706206899416&as_sdt=20000005&sciodt=0,21&hl=en&oe=ASCII&start=40",,,,,0
"https://scholar.google.com/scholar?cites=5262766697344003861&as_sdt=20000005&sciodt=0,21&hl=en&oe=ASCII&start=0","Ministerial survival during political and cabinet change: Foreign affairs, diplomacy and war","https://scholar.google.com/scholar?cluster=5262766697344003861&hl=en&as_sdt=20000005&sciodt=0,21",,,0
"https://scholar.google.com/scholar?cites=5262766697344003861&as_sdt=20000005&sciodt=0,21&hl=en&oe=ASCII&start=0",Who governs? A new global dataset on members of cabinets,https://www.cambridge.org/core/journals/american-political-science-review/article/who-governs-a-new-global-dataset-on-members-of-cabinets/3AE11258F668EB95F5A9F6904EF80A45,"J Nyrup, S Bramwell",,143
"https://scholar.google.com/scholar?cites=5262766697344003861&as_sdt=20000005&sciodt=0,21&hl=en&oe=ASCII&start=0",Cabinet reshuffles in parliamentary democracies: A typology and framework for comparative analysis,https://www.cambridge.org/core/journals/government-and-opposition/article/cabinet-reshuffles-in-parliamentary-democracies-a-typology-and-framework-for-comparative-analysis/E113A5FDB79CCE72E4E0CF2B79CE0AAC,"L Helms, M Vercesi",,11
"https://scholar.google.com/scholar?cites=5262766697344003861&as_sdt=20000005&sciodt=0,21&hl=en&oe=ASCII&start=0",Political loyalty and leader health,https://www.nowpublishers.com/article/Details/QJPS-17123,"BB De Mesquita, A Smith",,17
"https://scholar.google.com/scholar?cites=5262766697344003861&as_sdt=20000005&sciodt=0,21&hl=en&oe=ASCII&start=0","Tenure, promotion and performance: The career path of US ambassadors",https://link.springer.com/article/10.1007/s11558-017-9277-0,"E Arias, A Smith",,22
"https://scholar.google.com/scholar?cites=5262766697344003861&as_sdt=20000005&sciodt=0,21&hl=en&oe=ASCII&start=0",The Selection and Tenure of Foreign Ministers Around the World,https://www.cambridge.org/core/elements/selection-and-tenure-of-foreign-ministers-around-the-world/AFF8023333564D9B89DEFA04EA709EC9,"H Bäck, AQ Flores, J Teorell",,0
"https://scholar.google.com/scholar?cites=5262766697344003861&as_sdt=20000005&sciodt=0,21&hl=en&oe=ASCII&start=0","The Length of Service of Cabinet Ministers in Chile's Presidential Democracy, 1990–2022",https://onlinelibrary.wiley.com/doi/abs/10.1111/blar.13577,"H Jofré, P Navia, JM Cabezas",,0
"https://scholar.google.com/scholar?cites=5262766697344003861&as_sdt=20000005&sciodt=0,21&hl=en&oe=ASCII&start=0",Can Reshuffles Improve Government Popularity? Evidence from a “Pooling the Polls” Analysis,https://academic.oup.com/poq/article-abstract/82/2/322/4999361,H Miwa,,11
"https://scholar.google.com/scholar?cites=5262766697344003861&as_sdt=20000005&sciodt=0,21&hl=en&oe=ASCII&start=0",The Length of Service of Cabinet Ministers in Chile's Presidential Democracy,https://www.researchgate.net/profile/Hugo-Jofre-Rodriguez/publication/381543278_The_Length_of_Service_of_Cabinet_Ministers_in_Chile's_Presidential_Democracy_1990-2022/links/66e47f3fb1606e24c228ce0a/The-Length-of-Service-of-Cabinet-Ministers-in-Chiles-Presidential-Democracy-1990-2022.pdf,"H JOFRÉ, JM CABEZAS, P NAVIA",,0
"https://scholar.google.com/scholar?cites=5262766697344003861&as_sdt=20000005&sciodt=0,21&hl=en&oe=ASCII&start=0",Presidential power effects on government and ministerial durability: evidence from Central and Eastern Europe,https://www.cambridge.org/core/journals/european-political-science-review/article/presidential-power-effects-on-government-and-ministerial-durability-evidence-from-central-and-eastern-europe/747313D8CFC3A31841CEE4A33782D780,"E Semenova, K Dowding",,5
"https://scholar.google.com/scholar?cites=5262766697344003861&as_sdt=20000005&sciodt=0,21&hl=en&oe=ASCII&start=0",Are There Really Dictatorships?,https://books.google.com/books?hl=en&lr=&id=j8p-DwAAQBAJ&oi=fnd&pg=PA311&ots=Hz7D6DtGZ_&sig=ktx0IjN8pvfEB-EI6rKayK1FXZY,AQ Flores,,5
"https://scholar.google.com/scholar?cites=5262766697344003861&as_sdt=20000005&sciodt=0,21&hl=en&oe=ASCII&start=0",,,,,0
"https://scholar.google.com/scholar?cites=5262766697344003861&as_sdt=20000005&sciodt=0,21&hl=en&oe=ASCII&start=10","Ministerial survival during political and cabinet change: Foreign affairs, diplomacy and war","https://scholar.google.com/scholar?cluster=5262766697344003861&hl=en&as_sdt=20000005&sciodt=0,21",,,0
"https://scholar.google.com/scholar?cites=5262766697344003861&as_sdt=20000005&sciodt=0,21&hl=en&oe=ASCII&start=10","Integrantes del Centro de Gobierno en Chile: trayectorias, Capitales y características (1990-2022)",https://dialnet.unirioja.es/servlet/articulo?codigo=9088921,"H Jofré, NV Mena",,3
"https://scholar.google.com/scholar?cites=5262766697344003861&as_sdt=20000005&sciodt=0,21&hl=en&oe=ASCII&start=10","War, performance, and the survival of foreign ministers",https://academic.oup.com/fpa/article-abstract/17/2/oraa024/6111504,"H Bäck, J Teorell, A Von Hagen",,3
"https://scholar.google.com/scholar?cites=5262766697344003861&as_sdt=20000005&sciodt=0,21&hl=en&oe=ASCII&start=10",Democracy as procedure and principle: essays on social groups and democratization,https://ora.ox.ac.uk/objects/uuid:cfe1e5d2-c934-4e53-bfb5-4821bd3591ec,S Bramwell,,0
"https://scholar.google.com/scholar?cites=5262766697344003861&as_sdt=20000005&sciodt=0,21&hl=en&oe=ASCII&start=10","The Myth of the Benevolent Autocrat? Internal constraints, external constraints, and economic development in autocracies",https://ora.ox.ac.uk/objects/uuid:bf62b975-2259-474b-a468-dba7f01e879c,J Nyrup,,2
"https://scholar.google.com/scholar?cites=5262766697344003861&as_sdt=20000005&sciodt=0,21&hl=en&oe=ASCII&start=10",Political behaviour in the United Kingdom: An examination of Members of Parliament and Voters,https://repository.essex.ac.uk/22109/,P Leslie,,3
"https://scholar.google.com/scholar?cites=5262766697344003861&as_sdt=20000005&sciodt=0,21&hl=en&oe=ASCII&start=10",Cabinet Formation in Chile,https://link.springer.com/chapter/10.1007/978-3-030-92802-5_4,A Olivares L,,0
"https://scholar.google.com/scholar?cites=5262766697344003861&as_sdt=20000005&sciodt=0,21&hl=en&oe=ASCII&start=10",Why Are Ministers Important? The State of the Art on Ministers and Cabinets,https://link.springer.com/chapter/10.1007/978-3-030-92802-5_2,A Olivares L,,0
"https://scholar.google.com/scholar?cites=5262766697344003861&as_sdt=20000005&sciodt=0,21&hl=en&oe=ASCII&start=10",A desnecessária separação entre abordagem qualitativa ou quantitativa para a pesquisa jurídica: repensando as vantagens do pluralismo metodológico para a …,https://www.e-publicacoes.uerj.br/redp/article/view/33618,MD de Andrade…,,4
"https://scholar.google.com/scholar?cites=5262766697344003861&as_sdt=20000005&sciodt=0,21&hl=en&oe=ASCII&start=10",Who Becomes Minister in an Autocratic Regime? Evidence From DRC,https://mpra.ub.uni-muenchen.de/id/eprint/103022,O Kodila,,0
"https://scholar.google.com/scholar?cites=5262766697344003861&as_sdt=20000005&sciodt=0,21&hl=en&oe=ASCII&start=10",STANCE,https://portal.research.lu.se/files/37690562/2017_11_Quiroz_Flores_Ba_ck_von_Hagen_Jamar_Teorell.pdf,I War,,0
"https://scholar.google.com/scholar?cites=5262766697344003861&as_sdt=20000005&sciodt=0,21&hl=en&oe=ASCII&start=10",,,,,0
"https://scholar.google.com/scholar?cites=5262766697344003861&as_sdt=20000005&sciodt=0,21&hl=en&oe=ASCII&start=20","Ministerial survival during political and cabinet change: Foreign affairs, diplomacy and war","https://scholar.google.com/scholar?cluster=5262766697344003861&hl=en&as_sdt=20000005&sciodt=0,21",,,0
"https://scholar.google.com/scholar?cites=5262766697344003861&as_sdt=20000005&sciodt=0,21&hl=en&oe=ASCII&start=20","Solving the Decider's Dilemma: Scapegoats, Foreign Affairs, and the Duration of Interstate War",https://portal.research.lu.se/en/publications/solving-the-deciders-dilemma-scapegoats-foreign-affairs-and-the-d,"AQ Flores, H Bäck, A von Hagen",,0
"https://scholar.google.com/scholar?cites=5262766697344003861&as_sdt=20000005&sciodt=0,21&hl=en&oe=ASCII&start=20",UNNECESSARY DIVISION BETWEEN A QUALITATIVE OR QUANTITATIVE APPROACH TO LEGAL RESEARCH: RETHINKING THE ADVANTAGES OF …,https://go.gale.com/ps/i.do?id=GALE%7CA588839834&sid=googleScholar&v=2.1&it=r&linkaccess=abs&issn=19827636&p=AONE&sw=w,"MD de Andrade, RF de Castro Remigio",,0
"https://scholar.google.com/scholar?cites=5262766697344003861&as_sdt=20000005&sciodt=0,21&hl=en&oe=ASCII&start=20",,,,,0
"https://scholar.google.com/scholar?cites=5262766697344003861&as_sdt=20000005&sciodt=0,21&hl=en&oe=ASCII&start=30","Ministerial survival during political and cabinet change: Foreign affairs, diplomacy and war","https://scholar.google.com/scholar?cluster=5262766697344003861&hl=en&as_sdt=20000005&sciodt=0,21",,,0
"https://scholar.google.com/scholar?cites=5262766697344003861&as_sdt=20000005&sciodt=0,21&hl=en&oe=ASCII&start=30",,,,,0
"https://scholar.google.com/scholar?cites=5262766697344003861&as_sdt=20000005&sciodt=0,21&hl=en&oe=ASCII&start=40","Ministerial survival during political and cabinet change: Foreign affairs, diplomacy and war","https://scholar.google.com/scholar?cluster=5262766697344003861&hl=en&as_sdt=20000005&sciodt=0,21",,,0
"https://scholar.google.com/scholar?cites=5262766697344003861&as_sdt=20000005&sciodt=0,21&hl=en&oe=ASCII&start=40",,,,,0
"https://scholar.google.com/scholar?cites=718006239434791452&as_sdt=20000005&sciodt=0,21&hl=en&oe=ASCII&start=0",Scrutiny of ministerial ethics and standards of conduct in the UK: diluted accountability?,"https://scholar.google.com/scholar?cluster=718006239434791452&hl=en&as_sdt=20000005&sciodt=0,21",,,0
"https://scholar.google.com/scholar?cites=718006239434791452&as_sdt=20000005&sciodt=0,21&hl=en&oe=ASCII&start=0",Politics and Policy Making in the UK,https://books.google.com/books?hl=en&lr=&id=_A_jEAAAQBAJ&oi=fnd&pg=PR10&ots=JYzdX8XS6c&sig=ZHlo6_tlZx4mAwwjad1CJ_v4Iq0,"P Cairney, S Kippin",,29
"https://scholar.google.com/scholar?cites=718006239434791452&as_sdt=20000005&sciodt=0,21&hl=en&oe=ASCII&start=0",,,,,0
"https://scholar.google.com/scholar?cites=718006239434791452&as_sdt=20000005&sciodt=0,21&hl=en&oe=ASCII&start=10",Scrutiny of ministerial ethics and standards of conduct in the UK: diluted accountability?,"https://scholar.google.com/scholar?cluster=718006239434791452&hl=en&as_sdt=20000005&sciodt=0,21",,,0
"https://scholar.google.com/scholar?cites=718006239434791452&as_sdt=20000005&sciodt=0,21&hl=en&oe=ASCII&start=10",,,,,0
"https://scholar.google.com/scholar?cites=718006239434791452&as_sdt=20000005&sciodt=0,21&hl=en&oe=ASCII&start=20",Scrutiny of ministerial ethics and standards of conduct in the UK: diluted accountability?,"https://scholar.google.com/scholar?cluster=718006239434791452&hl=en&as_sdt=20000005&sciodt=0,21",,,0
"https://scholar.google.com/scholar?cites=718006239434791452&as_sdt=20000005&sciodt=0,21&hl=en&oe=ASCII&start=20",,,,,0
"https://scholar.google.com/scholar?cites=718006239434791452&as_sdt=20000005&sciodt=0,21&hl=en&oe=ASCII&start=30",Scrutiny of ministerial ethics and standards of conduct in the UK: diluted accountability?,"https://scholar.google.com/scholar?cluster=718006239434791452&hl=en&as_sdt=20000005&sciodt=0,21",,,0
"https://scholar.google.com/scholar?cites=718006239434791452&as_sdt=20000005&sciodt=0,21&hl=en&oe=ASCII&start=30",,,,,0
"https://scholar.google.com/scholar?cites=718006239434791452&as_sdt=20000005&sciodt=0,21&hl=en&oe=ASCII&start=40",Scrutiny of ministerial ethics and standards of conduct in the UK: diluted accountability?,"https://scholar.google.com/scholar?cluster=718006239434791452&hl=en&as_sdt=20000005&sciodt=0,21",,,0
"https://scholar.google.com/scholar?cites=718006239434791452&as_sdt=20000005&sciodt=0,21&hl=en&oe=ASCII&start=40",,,,,0
"https://scholar.google.com/scholar?cites=13644444239575745554&as_sdt=20000005&sciodt=0,21&hl=en&oe=ASCII&start=0",Public popularity as a part of the job description? Dismissing unpopular ministers,"https://scholar.google.com/scholar?cluster=13644444239575745554&hl=en&as_sdt=20000005&sciodt=0,21",,,0
"https://scholar.google.com/scholar?cites=13644444239575745554&as_sdt=20000005&sciodt=0,21&hl=en&oe=ASCII&start=0",The Comparative Politics of Cabinet Reshuffles,https://www.cambridge.org/core/journals/government-and-opposition/article/comparative-politics-of-cabinet-reshuffles/62000A120F9C2001D5C0C490F0037A35,"L Helms, M Vercesi",,7
"https://scholar.google.com/scholar?cites=13644444239575745554&as_sdt=20000005&sciodt=0,21&hl=en&oe=ASCII&start=0",Why do Parties Select Non-Partisan Ministers? The Paradox of Ministerial Selection in Austria,https://www.tandfonline.com/doi/abs/10.1080/00344893.2022.2111598,L Helms,,7
"https://scholar.google.com/scholar?cites=13644444239575745554&as_sdt=20000005&sciodt=0,21&hl=en&oe=ASCII&start=0",Control from the core? The impact of cabinet committees on ministers' legislative activity,https://www.cambridge.org/core/journals/european-political-science-review/article/control-from-the-core-the-impact-of-cabinet-committees-on-ministers-legislative-activity/63C3269E6BF7742845AB38E7C197BA4E,PH Nielsen,,1
