URL_citacion,Title,Citation_URL,Authors,Year,Number_of_Citations
"https://scholar.google.com/scholar?q=related:2gxOJV3thHwJ:scholar.google.com/&scioq=Ministerial+Replacement&hl=en&oe=ASCII&as_sdt=0,21&start=0",Parliamentary Control of Ministerial Policymaking,https://gupea.ub.gu.se/handle/2077/83538,"M Holmgren, C Dahlström",,0
"https://scholar.google.com/scholar?q=related:2gxOJV3thHwJ:scholar.google.com/&scioq=Ministerial+Replacement&hl=en&oe=ASCII&as_sdt=0,21&start=0","Legislative Policy making in Parliamentary Systems: Opportunities, Conflict and Institutional Constraints",https://air.unimi.it/handle/2434/37894,"F Franchino, B Høyland",,6
"https://scholar.google.com/scholar?q=related:2gxOJV3thHwJ:scholar.google.com/&scioq=Ministerial+Replacement&hl=en&oe=ASCII&as_sdt=0,21&start=0",Ministerial gatekeeping and parliamentary involvement in the implementation process of EU directives,https://link.springer.com/article/10.1007/s11127-013-0110-x,"T König, B Luig",,11
"https://scholar.google.com/scholar?q=related:2gxOJV3thHwJ:scholar.google.com/&scioq=Ministerial+Replacement&hl=en&oe=ASCII&as_sdt=0,21&start=0",Parliamentary oversight of the executives,https://www.torrossa.com/it/resources/an/5211623,E Griglio,,40
"https://scholar.google.com/scholar?q=related:2gxOJV3thHwJ:scholar.google.com/&scioq=Ministerial+Replacement&hl=en&oe=ASCII&as_sdt=0,21&start=0",Control from the core? The impact of cabinet committees on ministers' legislative activity,https://www.cambridge.org/core/journals/european-political-science-review/article/control-from-the-core-the-impact-of-cabinet-committees-on-ministers-legislative-activity/63C3269E6BF7742845AB38E7C197BA4E,PH Nielsen,,1
"https://scholar.google.com/scholar?q=related:2gxOJV3thHwJ:scholar.google.com/&scioq=Ministerial+Replacement&hl=en&oe=ASCII&as_sdt=0,21&start=0","Ministerial autonomy, parliamentary scrutiny and government reform output in parliamentary democracies",https://journals.sagepub.com/doi/abs/10.1177/00104140211024312,"H Bäck, WC Müller, M Angelova…",,21
"https://scholar.google.com/scholar?q=related:2gxOJV3thHwJ:scholar.google.com/&scioq=Ministerial+Replacement&hl=en&oe=ASCII&as_sdt=0,21&start=0",Norway: institutionally weak governments and parliamentary voting on bills,https://www.taylorfrancis.com/chapters/edit/10.4324/9780203837429-14/norway-bj%C3%B8rn-erik-rasch,BE Rasch,,7
"https://scholar.google.com/scholar?q=related:2gxOJV3thHwJ:scholar.google.com/&scioq=Ministerial+Replacement&hl=en&oe=ASCII&as_sdt=0,21&start=0",Circumventing coalition oversight in multiparty governments: Bill referral to parliamentary committees in the Finnish Eduskunta,https://journals.sagepub.com/doi/abs/10.1177/13540688211039636,"N Lin, N Yordanova",,1
"https://scholar.google.com/scholar?q=related:2gxOJV3thHwJ:scholar.google.com/&scioq=Ministerial+Replacement&hl=en&oe=ASCII&as_sdt=0,21&start=0",Parliamentary questions as a control mechanism in coalition governments,https://www.tandfonline.com/doi/abs/10.1080/01402382.2019.1611986,"D Höhmann, U Sieberer",,83
"https://scholar.google.com/scholar?q=related:2gxOJV3thHwJ:scholar.google.com/&scioq=Ministerial+Replacement&hl=en&oe=ASCII&as_sdt=0,21&start=0",Committee chairs and legislative review in parliamentary democracies,https://www.cambridge.org/core/journals/british-journal-of-political-science/article/committee-chairs-and-legislative-review-in-parliamentary-democracies/8C4123A1AB883BF27EADAB9AA360FE45,"D Fortunato, LW Martin, G Vanberg",,56
"https://scholar.google.com/scholar?q=related:2gxOJV3thHwJ:scholar.google.com/&scioq=Ministerial+Replacement&hl=en&oe=ASCII&as_sdt=0,21&start=10",Strategic postponement of coalition policymaking in European Parliamentary democracies,https://ejpr.onlinelibrary.wiley.com/doi/abs/10.1111/1475-6765.12677,X Lu,,0
"https://scholar.google.com/scholar?q=related:2gxOJV3thHwJ:scholar.google.com/&scioq=Ministerial+Replacement&hl=en&oe=ASCII&as_sdt=0,21&start=10",,,M Hallerberg,2000,6
"https://scholar.google.com/scholar?q=related:2gxOJV3thHwJ:scholar.google.com/&scioq=Ministerial+Replacement&hl=en&oe=ASCII&as_sdt=0,21&start=10",Parliamentary control of coalition governments,https://www.annualreviews.org/content/journals/10.1146/annurev.polisci.10.071105.104340,"K Strøm, WC Müller, DM Smith",,225
"https://scholar.google.com/scholar?q=related:2gxOJV3thHwJ:scholar.google.com/&scioq=Ministerial+Replacement&hl=en&oe=ASCII&as_sdt=0,21&start=10",Government dominance and the role of opposition in parliamentary democracies,https://ejpr.onlinelibrary.wiley.com/doi/abs/10.1111/1475-6765.12525,"T König, N Lin, TN Silva",,10
"https://scholar.google.com/scholar?q=related:2gxOJV3thHwJ:scholar.google.com/&scioq=Ministerial+Replacement&hl=en&oe=ASCII&as_sdt=0,21&start=10",Using the Party as a Shield? How British MPs Explain Policy Positions to Constituents,https://osf.io/preprints/z8ycg/,"D Bischof, V Cheng",,0
"https://scholar.google.com/scholar?q=related:2gxOJV3thHwJ:scholar.google.com/&scioq=Ministerial+Replacement&hl=en&oe=ASCII&as_sdt=0,21&start=10",Legislatures and legislative behaviour,https://www.elgaronline.com/edcollchap/book/9781803929095/book-part-9781803929095-24.xml,"H Bäck, M Debus",,0
"https://scholar.google.com/scholar?q=related:2gxOJV3thHwJ:scholar.google.com/&scioq=Ministerial+Replacement&hl=en&oe=ASCII&as_sdt=0,21&start=10",Agenda control and timing of bill initiation: A temporal perspective on coalition governance in parliamentary democracies,https://www.cambridge.org/core/journals/american-political-science-review/article/agenda-control-and-timing-of-bill-initiation-a-temporal-perspective-on-coalition-governance-in-parliamentary-democracies/A34146E7CC3D7093C6353D88A7D44378,"T König, N Lin, X Lu, TN Silva, N Yordanova…",,13
"https://scholar.google.com/scholar?q=related:2gxOJV3thHwJ:scholar.google.com/&scioq=Ministerial+Replacement&hl=en&oe=ASCII&as_sdt=0,21&start=10",Greece: government as the dominant player,https://www.taylorfrancis.com/chapters/edit/10.4324/9780203837429-9/greece-aris-alexopoulos,A Alexopoulos,,4
"https://scholar.google.com/scholar?q=related:2gxOJV3thHwJ:scholar.google.com/&scioq=Ministerial+Replacement&hl=en&oe=ASCII&as_sdt=0,21&start=10",Parliaments and Government Termination: A New Perspective on Parliamentary Democracies,https://books.google.com/books?hl=en&lr=&id=BqTMEAAAQBAJ&oi=fnd&pg=PP1&dq=related:2gxOJV3thHwJ:scholar.google.com/&ots=zRWGijTIje&sig=HHn06af2x-SOFTr-ILhKgTlB9qo,"RY Hazan, BE Rasch",,1
"https://scholar.google.com/scholar?q=related:2gxOJV3thHwJ:scholar.google.com/&scioq=Ministerial+Replacement&hl=en&oe=ASCII&as_sdt=0,21&start=10",Constructive and destructive legislative review: The government-opposition divide in parliamentary oversight,https://www.journals.uchicago.edu/doi/abs/10.1086/720649,"L Behrens, D Nyhuis, T Gschwend",,5
"https://scholar.google.com/scholar?q=related:2gxOJV3thHwJ:scholar.google.com/&scioq=Ministerial+Replacement&hl=en&oe=ASCII&as_sdt=0,21&start=20",Ministerial policy dominance in parliamentary democracies,https://ejpr.onlinelibrary.wiley.com/doi/abs/10.1111/1475-6765.12545,"KJ Klüser, C Breunig",,8
"https://scholar.google.com/scholar?q=related:2gxOJV3thHwJ:scholar.google.com/&scioq=Ministerial+Replacement&hl=en&oe=ASCII&as_sdt=0,21&start=20",Watch-dogs that Cannot Bite? New National Parliamentary Control Mechanisms under the Lisbon Treaty,https://www.taylorfrancis.com/chapters/edit/10.4324/9781315576466-5/watch-dogs-cannot-bite-new-national-parliamentary-control-mechanisms-lisbon-treaty-aleksandra-maatsch,A Maatsch,,2
"https://scholar.google.com/scholar?q=related:2gxOJV3thHwJ:scholar.google.com/&scioq=Ministerial+Replacement&hl=en&oe=ASCII&as_sdt=0,21&start=20",The Legitimate Secret,https://www.sv.uio.no/isv/english/research/projects/evolution-parliamentarism/events/seminars/legitimatesecret_2013_mk_istanbul_2013-koss.pdf,M Koß,,1
"https://scholar.google.com/scholar?q=related:2gxOJV3thHwJ:scholar.google.com/&scioq=Ministerial+Replacement&hl=en&oe=ASCII&as_sdt=0,21&start=20",Germany: Limited government agenda control and strong minority rights,https://www.taylorfrancis.com/chapters/edit/10.4324/9780203837429-2/germany-christoph-h%C3%B6nnige-ulrich-sieberer,"C Hönnige, U Sieberer",,21
"https://scholar.google.com/scholar?q=related:2gxOJV3thHwJ:scholar.google.com/&scioq=Ministerial+Replacement&hl=en&oe=ASCII&as_sdt=0,21&start=20",Parliamentary agenda control and legislative outcomes in Western Europe,https://heinonline.org/hol-cgi-bin/get_pdf.cgi?handle=hein.journals/lgvessqy26&section=11,H Doring,,224
"https://scholar.google.com/scholar?q=related:2gxOJV3thHwJ:scholar.google.com/&scioq=Ministerial+Replacement&hl=en&oe=ASCII&as_sdt=0,21&start=20",Legislative Control over Executive Law‐making: Delegation of Quasi‐legislative Powers to the European Commission,https://onlinelibrary.wiley.com/doi/abs/10.1111/jcms.12943,"N Yordanova, A Zhelyazkova",,14
"https://scholar.google.com/scholar?q=related:2gxOJV3thHwJ:scholar.google.com/&scioq=Ministerial+Replacement&hl=en&oe=ASCII&as_sdt=0,21&start=20",Fixed‐Term Parliaments and the Challenges for Governments and the Civil Service: A Comparative Perspective,https://onlinelibrary.wiley.com/doi/abs/10.1111/1467-923X.12073,"P Schleiter, S Issar",,9
"https://scholar.google.com/scholar?q=related:2gxOJV3thHwJ:scholar.google.com/&scioq=Ministerial+Replacement&hl=en&oe=ASCII&as_sdt=0,21&start=20",Parliamentary Scrutiny and Influence on Government Bills,https://books.google.com/books?hl=en&lr=&id=Z49HDwAAQBAJ&oi=fnd&pg=PA80&dq=related:2gxOJV3thHwJ:scholar.google.com/&ots=iEDMYKtM30&sig=uvK90SxifzLhB00HjO9QnMQ4Irk,"M Russell, D Gover",,1
"https://scholar.google.com/scholar?q=related:2gxOJV3thHwJ:scholar.google.com/&scioq=Ministerial+Replacement&hl=en&oe=ASCII&as_sdt=0,21&start=20",Agenda control by committee chairs in fragmented multi-party parliaments: A Knesset case study,https://www.berghahnjournals.com/view/journals/israel-studies-review/33/1/isr330105.xml,M Rosenthal,,8
"https://scholar.google.com/scholar?q=related:2gxOJV3thHwJ:scholar.google.com/&scioq=Ministerial+Replacement&hl=en&oe=ASCII&as_sdt=0,21&start=20",Parliamentary arbitrage and the case for regulatory policy in parliament,https://www.tandfonline.com/doi/abs/10.1080/20508840.2020.1730096,"G Mor, A Jasper",,3
"https://scholar.google.com/scholar?q=related:2gxOJV3thHwJ:scholar.google.com/&scioq=Ministerial+Replacement&hl=en&oe=ASCII&as_sdt=0,21&start=30","“Trust is good, control is better” multiparty government and legislative organization",https://journals.sagepub.com/doi/abs/10.1177/1065912915623639,"A André, S Depauw, S Martin",,84
"https://scholar.google.com/scholar?q=related:2gxOJV3thHwJ:scholar.google.com/&scioq=Ministerial+Replacement&hl=en&oe=ASCII&as_sdt=0,21&start=30",Denmark: Agenda control and veto rights to opposition parties,https://www.taylorfrancis.com/chapters/edit/10.4324/9780203837429-13/denmark-robert-klemmensen,R Klemmensen,,2
"https://scholar.google.com/scholar?q=related:2gxOJV3thHwJ:scholar.google.com/&scioq=Ministerial+Replacement&hl=en&oe=ASCII&as_sdt=0,21&start=30",Ensuring democratic control over national governments in European affairs,https://www.researchgate.net/profile/Tapio-Raunio/publication/360033805_Ensuring_Democratic_Control_over_National_Governments_in_European_Affairs/links/625e88e44173a21a0d1e142d/Ensuring-Democratic-Control-over-National-Governments-in-European-Affairs.pdf,T Raunio,,13
"https://scholar.google.com/scholar?q=related:2gxOJV3thHwJ:scholar.google.com/&scioq=Ministerial+Replacement&hl=en&oe=ASCII&as_sdt=0,21&start=30",,,P Bundi,2016,1
"https://scholar.google.com/scholar?q=related:2gxOJV3thHwJ:scholar.google.com/&scioq=Ministerial+Replacement&hl=en&oe=ASCII&as_sdt=0,21&start=30",Sven Siefken und Hilmar Rommetvedt (Hrsg.). 2021. Parliamentary committees in the policy process,https://link.springer.com/article/10.1007/s12286-022-00553-5,S Wegmann,,0
"https://scholar.google.com/scholar?q=related:2gxOJV3thHwJ:scholar.google.com/&scioq=Ministerial+Replacement&hl=en&oe=ASCII&as_sdt=0,21&start=30",Structuring Legislative Behavior-How Institutions Shape Political Interaction in Parliament and Beyond,http://kups.ub.uni-koeln.de/id/eprint/62286,J Schwalbach,,0
"https://scholar.google.com/scholar?q=related:2gxOJV3thHwJ:scholar.google.com/&scioq=Ministerial+Replacement&hl=en&oe=ASCII&as_sdt=0,21&start=30",Signals to their parliaments? Governments' use of votes and policy statements in the EU Council,https://onlinelibrary.wiley.com/doi/abs/10.1111/jcms.12844,"S Hagemann, S Bailer, A Herzog",,45
"https://scholar.google.com/scholar?q=related:2gxOJV3thHwJ:scholar.google.com/&scioq=Ministerial+Replacement&hl=en&oe=ASCII&as_sdt=0,21&start=30",How are prime ministers held to account? Exploring procedures and practices in 31 parliamentary democracies,https://www.tandfonline.com/doi/abs/10.1080/13572334.2020.1853944,R Serban,,13
"https://scholar.google.com/scholar?q=related:2gxOJV3thHwJ:scholar.google.com/&scioq=Ministerial+Replacement&hl=en&oe=ASCII&as_sdt=0,21&start=30",Party Institutionalization and Legislative Organization: The Evolution of Agenda Power in the Polish Parliament,https://papers.ssrn.com/Sol3/papers.cfm?abstract_id=1642432,"R Carroll, M Nalepa",,1
"https://scholar.google.com/scholar?q=related:2gxOJV3thHwJ:scholar.google.com/&scioq=Ministerial+Replacement&hl=en&oe=ASCII&as_sdt=0,21&start=30",The origins of parliamentary agenda control: A comparative process tracing analysis,https://www.tandfonline.com/doi/abs/10.1080/01402382.2015.1045319,M Koß,,32
"https://scholar.google.com/scholar?q=related:2gxOJV3thHwJ:scholar.google.com/&scioq=Ministerial+Replacement&hl=en&oe=ASCII&as_sdt=0,21&start=40",Does government dominate the legislative process?,http://dspace.stir.ac.uk/handle/1893/33983,S MacGregor,,0
"https://scholar.google.com/scholar?q=related:2gxOJV3thHwJ:scholar.google.com/&scioq=Ministerial+Replacement&hl=en&oe=ASCII&as_sdt=0,21&start=40",Executive-legislative relations in parliamentary systems: policy-making and legislative processes,https://link.springer.com/book/10.1007/978-3-030-92343-3,P Calca,,6
"https://scholar.google.com/scholar?q=related:2gxOJV3thHwJ:scholar.google.com/&scioq=Ministerial+Replacement&hl=en&oe=ASCII&as_sdt=0,21&start=40",Government selection and executive powers: Constitutional design in parliamentary democracies,https://www.taylorfrancis.com/chapters/edit/10.4324/9781003397168-10/government-selection-executive-powers-constitutional-design-parliamentary-democracies-jos%C3%A9-antonio-cheibub-shane-martin-bj%C3%B8rn-erik-rasch,"JA Cheibub, S Martin, BE Rasch",,63
"https://scholar.google.com/scholar?q=related:2gxOJV3thHwJ:scholar.google.com/&scioq=Ministerial+Replacement&hl=en&oe=ASCII&as_sdt=0,21&start=40",Governmental Agenda Control in a Busy Parliament: Evidence from Israel,https://papers.ssrn.com/sol3/papers.cfm?abstract_id=4881252,T Elovits,,0
"https://scholar.google.com/scholar?q=related:2gxOJV3thHwJ:scholar.google.com/&scioq=Ministerial+Replacement&hl=en&oe=ASCII&as_sdt=0,21&start=40",Coalition government and party mandate,https://api.taylorfrancis.com/content/books/mono/download?identifierName=doi&identifierValue=10.4324/9780203084045&type=googlepdf,C Moury,,40
"https://scholar.google.com/scholar?q=related:2gxOJV3thHwJ:scholar.google.com/&scioq=Ministerial+Replacement&hl=en&oe=ASCII&as_sdt=0,21&start=40",Parliamentary administrations in the European Union,https://books.google.com/books?hl=en&lr=&id=kC7uCwAAQBAJ&oi=fnd&pg=PP1&dq=related:2gxOJV3thHwJ:scholar.google.com/&ots=6rq5NJP342&sig=WL-R7Fo9jXvdNM42MjVxurYv6JU,"AL Högenauer, C Neuhold, T Christiansen",,45
"https://scholar.google.com/scholar?q=related:2gxOJV3thHwJ:scholar.google.com/&scioq=Ministerial+Replacement&hl=en&oe=ASCII&as_sdt=0,21&start=40",Parliamentary Control of the Executive and the Duration of Government Formation,https://onlinelibrary.wiley.com/doi/abs/10.1111/lsq.12443,"L Aaskoven, S Martin",,0
"https://scholar.google.com/scholar?q=related:2gxOJV3thHwJ:scholar.google.com/&scioq=Ministerial+Replacement&hl=en&oe=ASCII&as_sdt=0,21&start=40",The role of parliamentary committees in the budgetary process in the Central and Eastern European countries,https://link.springer.com/chapter/10.1007/978-3-531-91773-3_10,"S Yläoutinen, M Hallerberg",,21
"https://scholar.google.com/scholar?q=related:2gxOJV3thHwJ:scholar.google.com/&scioq=Ministerial+Replacement&hl=en&oe=ASCII&as_sdt=0,21&start=40",A Strategic Model of Coalition Governance in Parliamentary Democracies,https://papers.ssrn.com/sol3/papers.cfm?abstract_id=2106492,"S Boranbay, TE König, SO Proksch",,1
"https://scholar.google.com/scholar?q=related:2gxOJV3thHwJ:scholar.google.com/&scioq=Ministerial+Replacement&hl=en&oe=ASCII&as_sdt=0,21&start=40",The politics of parliamentary agenda-setting styles,https://www.taylorfrancis.com/chapters/edit/10.4324/9780429286322-25/politics-parliamentary-agenda-setting-styles-shaun-bevan-enrico-borghetto-henrik-seeberg,"S Bevan, E Borghetto, H Seeberg",,1
"https://scholar.google.com/scholar?cites=15955870629680345682&as_sdt=20000005&sciodt=0,21&hl=en&oe=ASCII&start=0",The logic of ministerial selection: Electoral system and cabinet appointments in Japan,"https://scholar.google.com/scholar?cluster=15955870629680345682&hl=en&as_sdt=20000005&sciodt=0,21",,,0
"https://scholar.google.com/scholar?cites=15955870629680345682&as_sdt=20000005&sciodt=0,21&hl=en&oe=ASCII&start=0",From pork to policy: The rise of programmatic campaigning in Japanese elections,https://www.journals.uchicago.edu/doi/abs/10.1086/683073,A Catalinac,,135
"https://scholar.google.com/scholar?cites=15955870629680345682&as_sdt=20000005&sciodt=0,21&hl=en&oe=ASCII&start=0","The presidentialization of political parties: Organizations, institutions and leaders",https://books.google.com/books?hl=en&lr=&id=YbKhCgAAQBAJ&oi=fnd&pg=PP1&ots=X4vqxvlIRi&sig=PNjkTlrF4awGqB41pl0Qktm7T_w,G Passarelli,,133
"https://scholar.google.com/scholar?cites=15955870629680345682&as_sdt=20000005&sciodt=0,21&hl=en&oe=ASCII&start=0",Political dynasties and the selection of cabinet ministers,https://onlinelibrary.wiley.com/doi/abs/10.1111/lsq.12146,"DM Smith, S Martin",,88
"https://scholar.google.com/scholar?cites=15955870629680345682&as_sdt=20000005&sciodt=0,21&hl=en&oe=ASCII&start=0",Positioning under alternative electoral systems: evidence from Japanese candidate election manifestos,https://www.cambridge.org/core/journals/american-political-science-review/article/positioning-under-alternative-electoral-systems-evidence-from-japanese-candidate-election-manifestos/D0D7EE4EEDBDEED88F6550AEA2841870,A Catalinac,,75
"https://scholar.google.com/scholar?cites=15955870629680345682&as_sdt=20000005&sciodt=0,21&hl=en&oe=ASCII&start=0","The Presidentialization of parties: why, when, where",https://link.springer.com/chapter/10.1057/9781137482464_13,G Passarelli,,37
"https://scholar.google.com/scholar?cites=15955870629680345682&as_sdt=20000005&sciodt=0,21&hl=en&oe=ASCII&start=0",The LDP: Return to dominance? Or a golden age built on sand?,https://brill.com/downloadpdf/book/edcoll/9789004380554/BP000080.pdf,"M Endo, RJ Pekkanen",,6
"https://scholar.google.com/scholar?cites=15955870629680345682&as_sdt=20000005&sciodt=0,21&hl=en&oe=ASCII&start=0",自民党政権における派閥と役職人事,https://soka.repo.nii.ac.jp/record/2000108/files/sokahogaku53_2_4.pdf,和足憲明,,1
"https://scholar.google.com/scholar?cites=15955870629680345682&as_sdt=20000005&sciodt=0,21&hl=en&oe=ASCII&start=0","Ministerial Selection Under Abe, Suga, and Kishida",https://link.springer.com/chapter/10.1007/978-3-031-11324-6_11,H Kubo,,0
"https://scholar.google.com/scholar?cites=15955870629680345682&as_sdt=20000005&sciodt=0,21&hl=en&oe=ASCII&start=0",Japan's Liberal Democratic Party: Changes in Party Organization under Shinzō Abe,https://academic.oup.com/edited-volume/40699/chapter/348428300,K Nemoto,,4
"https://scholar.google.com/scholar?cites=15955870629680345682&as_sdt=20000005&sciodt=0,21&hl=en&oe=ASCII&start=0",The logic of delegation and institutional contexts: Ministerial selection under mixed-member systems in Japan,https://journals.sagepub.com/doi/abs/10.1177/2057891118811686,H Kubo,,2
"https://scholar.google.com/scholar?cites=15955870629680345682&as_sdt=20000005&sciodt=0,21&hl=en&oe=ASCII&start=0",,,,,0
"https://scholar.google.com/scholar?cites=15955870629680345682&as_sdt=20000005&sciodt=0,21&hl=en&oe=ASCII&start=10",The logic of ministerial selection: Electoral system and cabinet appointments in Japan,"https://scholar.google.com/scholar?cluster=15955870629680345682&hl=en&as_sdt=20000005&sciodt=0,21",,,0
"https://scholar.google.com/scholar?cites=15955870629680345682&as_sdt=20000005&sciodt=0,21&hl=en&oe=ASCII&start=10",Technocrats and Politruks: Polish Ministers Between 2001 and 2020,https://www.ceeol.com/search/article-detail?id=1168928,R DUMITRESCU,,0
"https://scholar.google.com/scholar?cites=15955870629680345682&as_sdt=20000005&sciodt=0,21&hl=en&oe=ASCII&start=10",Why Foreign Policy Principles Persist: Understanding the Reinterpretations of Japan's Article 9 and Switzerland's Neutrality,https://scholarship.claremont.edu/pomona_theses/157/,Y Numata,,1
"https://scholar.google.com/scholar?cites=15955870629680345682&as_sdt=20000005&sciodt=0,21&hl=en&oe=ASCII&start=10",首相と党内統治 人事と造反,https://www.jstage.jst.go.jp/article/jaes/31/2/31_32/_article/-char/ja/,濱本真輔,,2
"https://scholar.google.com/scholar?cites=15955870629680345682&as_sdt=20000005&sciodt=0,21&hl=en&oe=ASCII&start=10",Institutional Change and Legislative Speech: The Creation of Responsible Party Government in Japan,https://www.cambridge.org/core/membership/services/aop-file-manager/file/5c2e1d285f87cb0c188b47d8,"M Goplerud, DM Smith",,0
"https://scholar.google.com/scholar?cites=15955870629680345682&as_sdt=20000005&sciodt=0,21&hl=en&oe=ASCII&start=10",諸外国における閣僚研究に関する理論的検討,https://meiji.repo.nii.ac.jp/record/17423/files/seijikeizaikenkyuron_12_41.pdf,野山毅人,,0
"https://scholar.google.com/scholar?cites=15955870629680345682&as_sdt=20000005&sciodt=0,21&hl=en&oe=ASCII&start=10",Essays on functions and organisations of political parties,http://etheses.lse.ac.uk/3383,S Lee,,0
"https://scholar.google.com/scholar?cites=15955870629680345682&as_sdt=20000005&sciodt=0,21&hl=en&oe=ASCII&start=10",What Makes SSJJ the Leading Journal of Japanese Studies?,https://academic.oup.com/ssjj/article-abstract/19/1/23/2451769,"M Matoba, T Onji",,0
"https://scholar.google.com/scholar?cites=15955870629680345682&as_sdt=20000005&sciodt=0,21&hl=en&oe=ASCII&start=10",首相の地位維持策としての内閣改造,https://www.jstage.jst.go.jp/article/nenpouseijigaku/70/2/70_2_264/_article/-char/ja/,上條諒貴,,0
"https://scholar.google.com/scholar?cites=15955870629680345682&as_sdt=20000005&sciodt=0,21&hl=en&oe=ASCII&start=10",,,K Nemoto,,0
"https://scholar.google.com/scholar?cites=15955870629680345682&as_sdt=20000005&sciodt=0,21&hl=en&oe=ASCII&start=10",,,,,0
"https://scholar.google.com/scholar?cites=15955870629680345682&as_sdt=20000005&sciodt=0,21&hl=en&oe=ASCII&start=20",The logic of ministerial selection: Electoral system and cabinet appointments in Japan,"https://scholar.google.com/scholar?cluster=15955870629680345682&hl=en&as_sdt=20000005&sciodt=0,21",,,0
"https://scholar.google.com/scholar?cites=15955870629680345682&as_sdt=20000005&sciodt=0,21&hl=en&oe=ASCII&start=20",,,,,0
"https://scholar.google.com/scholar?cites=15955870629680345682&as_sdt=20000005&sciodt=0,21&hl=en&oe=ASCII&start=30",The logic of ministerial selection: Electoral system and cabinet appointments in Japan,"https://scholar.google.com/scholar?cluster=15955870629680345682&hl=en&as_sdt=20000005&sciodt=0,21",,,0
"https://scholar.google.com/scholar?cites=15955870629680345682&as_sdt=20000005&sciodt=0,21&hl=en&oe=ASCII&start=30",,,,,0
"https://scholar.google.com/scholar?cites=15955870629680345682&as_sdt=20000005&sciodt=0,21&hl=en&oe=ASCII&start=40",The logic of ministerial selection: Electoral system and cabinet appointments in Japan,"https://scholar.google.com/scholar?cluster=15955870629680345682&hl=en&as_sdt=20000005&sciodt=0,21",,,0
"https://scholar.google.com/scholar?cites=15955870629680345682&as_sdt=20000005&sciodt=0,21&hl=en&oe=ASCII&start=40",,,,,0
"https://scholar.google.com/scholar?cites=14529597381906937812&as_sdt=20000005&sciodt=0,21&hl=en&oe=ASCII&start=0",The Strange Case of Non-Ministerial Departments,"https://scholar.google.com/scholar?cluster=14529597381906937812&hl=en&as_sdt=20000005&sciodt=0,21",,,0
"https://scholar.google.com/scholar?cites=14529597381906937812&as_sdt=20000005&sciodt=0,21&hl=en&oe=ASCII&start=0","Imagining cooperative tax regulation: Common origins, divergent paths",https://www.sciencedirect.com/science/article/pii/S1045235422000314,"D De Widt, L Oats",,13
"https://scholar.google.com/scholar?cites=14529597381906937812&as_sdt=20000005&sciodt=0,21&hl=en&oe=ASCII&start=0",Making and implementing public policy: key concepts and issues,https://books.google.com/books?hl=en&lr=&id=JBtHEAAAQBAJ&oi=fnd&pg=PR1&ots=MbvNuFKwjG&sig=3Y_RCcdB1LMUp9u87JhudWW15Z4,"C Bochel, H Bochel",,26
"https://scholar.google.com/scholar?cites=14529597381906937812&as_sdt=20000005&sciodt=0,21&hl=en&oe=ASCII&start=0",Bonfires and barbecues: coalition governance and the politics of quango reform,https://www.tandfonline.com/doi/abs/10.1080/13619462.2014.882776,"M Flinders, K Dommett, K Tonkiss",,38
"https://scholar.google.com/scholar?cites=14529597381906937812&as_sdt=20000005&sciodt=0,21&hl=en&oe=ASCII&start=0",Restoring trust in the 'fairness' of corporate taxation: increased transparency and the need for institutional reform,https://papers.ssrn.com/sol3/papers.cfm?abstract_id=3396775,J Freedman,,21
